{
  "$schema": "http://json-schema.org/draft-07/schema#",
  "title": "Portable rule",
  "type": "object",
  "additionalProperties": false,
  "required": ["id", "requirements", "capabilities"],
  "properties": {
    "$schema": { "type": "string" },
    "id": { "type": "string", "pattern": "^[a-z0-9][a-z0-9-]*$" },
    "title": { "type": "string", "minLength": 1 },
    "description": { "type": "string", "minLength": 1 },
    "purpose": { "type": "string", "minLength": 1 },
    "requirements": { "type": "array", "minItems": 1, "items": { "type": "string", "minLength": 1 } },
    "invariants": { "type": "array", "items": { "type": "string", "minLength": 1 } },
    "capabilities": { "type": "array", "uniqueItems": true, "items": { "type": "string", "minLength": 1 } },
    "requiredCapabilities": { "type": "array", "uniqueItems": true, "items": { "type": "string", "minLength": 1 } },
    "allowedCapabilities": { "type": "array", "uniqueItems": true, "items": { "type": "string", "minLength": 1 } },
    "skills": { "type": "array", "uniqueItems": true, "items": { "type": "string", "pattern": "^[a-z0-9][a-z0-9-]*$" } },
    "requiredSkills": { "type": "array", "uniqueItems": true, "items": { "type": "string", "pattern": "^[a-z0-9][a-z0-9-]*$" } },
    "skillIds": { "type": "array", "uniqueItems": true, "items": { "type": "string", "pattern": "^[a-z0-9][a-z0-9-]*$" } },
    "roles": { "type": "array", "uniqueItems": true, "items": { "type": "string", "pattern": "^[a-z0-9][a-z0-9-]*$" } },
    "workflows": { "type": "array", "uniqueItems": true, "items": { "type": "string", "pattern": "^[a-z0-9][a-z0-9-]*$" } },
    "severity": { "type": "string", "enum": ["info", "warning", "error"] },
    "tags": { "type": "array", "uniqueItems": true, "items": { "type": "string", "minLength": 1 } }
  }
}
